id;Program;type;length;credits;description;url;keywords;;;;;;;;;;;;;;;;;;;;
43;Geofysik;Master;2;120;Hur fungerar jorden och hur tar vi reda på de processer som formar vår planet? Inom geofysiken använder vi verktyg och metoder från fysiken när vi studerar jorden. Vid geofysikinriktningen kombinerar du fysikkunskaper med resultat från fältmätningar, laboratorieexperiment och datormodellering för att fördjupa kunskapen om planeten jorden.;https://www.uu.se/utbildning/program/masterprogram-fysik-geofysik;Fysik;Geofysik;;;;;;;;;;;;;;;;;;;
44;Hållbar destinationsutveckling (120hp)- utlyses inte 2024;Master;2;120;Vill du lösa framtidens energiutmaningar med ny teknik och entreprenörskap? Masterprogrammet i energiteknik ger dig kunskap om energitekniker och färdigheter i problemlösning, innovation och ledarskap. Programmet är ett samarbete mellan fyra europeiska universitet och du kommer att studera vid flera av dessa under utbildningen. Efter examen kommer du att ha ett brett personligt nätverk och utmärkta karriärmöjligheter inom den europeiska energisektorn.;;Hållbar Utveckling;;;;;;;;;;;;;;;;;;;;
45;Hållbar och innovativ hantering av naturresurser - SINReM;Master;2;120;Vill du vara delaktig i den gröna omställningen för hållbar prospektering och utvinning av mineralresurser? Inom masterprogrammet i hållbar och innovativ hantering av naturresurser - SINReM kan du studera, forska och starta eget företag. Du får möjlighet att skapa hållbara förändringar för jordens resurser tillsammans med aktuella initiativ inom industrin.;;Hållbar Utveckling;Materialvetenskap;;;;;;;;;;;;;;;;;;;
46;Hållbar utveckling;Master;2;120;Vill du få de kunskaper och färdigheter som krävs för att hantera komplexa utmaningar för en hållbar utveckling? Är du intresserad av att studera tillsammans med studenter från en mängd olika länder och bakgrunder? Strävar du efter att vara en del av och bidra till en hållbar framtid? Masterprogrammet i hållbar utveckling bygger på tre pelare - tvärvetenskap, systemtänkande och framtidsorientering, som genomsyrar alla våra kurser.;;Hållbar Utveckling;;;;;;;;;;;;;;;;;;;;
47;Inbyggda system;Master;2;120;Vill du lära dig att konstruera och analysera inbyggda system samt säkerställa deras korrekta funktion? Då är Masterprogrammet i inbyggda system rätt för dig. Programmet ger dig en djupgående utbildning inom data- och systemvetenskap för inbyggda system och betonar design, implementering och analys av programvara. Du får också färdigheter i att skriva programvara i olika utvecklingsmiljöer och programmeringsparadigm.;;Datavetenskap;Systemvetenskap;;;;;;;;;;;;;;;;;;;
48;Industriell analys;Master;2;120;Vill du utveckla nästa generations digitala och hållbara industriella system baserat på unik expertis inom både industriell teknik och datavetenskap? Masterprogrammet i industriell analys är unikt i sitt slag och kombinerar ämnen som systemanalys, dataanalys, AI och simulering. Som student vid programmet studerar du inom ett högaktuellt område där kompetensbehoven växer mycket snabbt.;;Dataanalys;Industriell Teknik;;;;;;;;;;;;;;;;;;;
49;Industriell ledning och innovation;Master;2;120;Vill du ha en karriär som kretsar kring att leda innovativa processer? Uppsala universitet erbjuder dig en bas för att driva innovationsarbete inom teknikintensiva företag inom olika branscher. Oavsett om du startar ett eget företag eller arbetar för ett etablerat företag, ger masterprogrammet i industriell ledning och innovation en djup förståelse samt en rad olika verktyg för att hantera komplexa innovationsprocesser.;;Industriell Teknik;;;;;;;;;;;;;;;;;;;;
50;Kärn och partikelfysik;Master;2;120;Vill du förstå naturen på en grundläggande nivå och utforska universums mest våldsamma fenomen? Vill du lära dig teoretiska och experimentella metoder som används av forskare inom området? Då passar masterprogrammet i fysik med en inriktning mot kärn- och partikelfysik. Forskningen är både teoretisk och experimentell, och tekniken som gör experimenten möjliga används även inom andra områden, till exempel teknik, ekonomi och medicin.;https://www.uu.se/utbildning/program/masterprogram-fysik-karn-och-partikelfysik;Fysik;Kärnfysik;Partikelfysik;;;;;;;;;;;;;;;;;;
51;Kemi - Bio- nanomaterial;Master;2;120;Är du redo att dyka in i den spännande värld där vetenskap möter innovation? Vår inriktning i bio- och nanomaterial inom masterprogrammet i kemi är din inkörsport till en värld av oändliga möjligheter inom biomedicin, läkemedel och material. I detta dynamiska och tvärvetenskapliga program kommer du att utforska både teori och praktiska tillämpningar och förbereda dig för en karriär i framkanten av vetenskap och utveckling av nya produkter.;https://www.uu.se/utbildning/program/masterprogram-kemi-bio-och-nanomaterial;Kemi;Materialvetenskap;;;;;;;;;;;;;;;;;;;
52;Kemi för förnybar energi;Master;2;120;Övergången till ett samhälle baserat på förnybara energikällor pågår just nu och du kan vara med och bidra till förändringen. Inriktningen kemi för förnybar energi inom masterprogrammet i kemi ger dig en spetskompetens inom den fascinerande kemi som behövs i utvecklingen av nya lösningar för både hållbar produktion av el och av energilagring. Efter examen är du väl förberedd för en framtid inom både akademin eller forskning och utveckling inom den privata sektorn.;https://www.uu.se/utbildning/program/masterprogram-kemi-kemi-for-fornybar-energi;Energiteknik;;;;;;;;;;;;;;;;;;;;
53;Kemisk biologi;Master;2;120;Vill du vara en del av banbrytande forskning? Masterprogrammet i kemi med inriktning kemisk biologi är nära kopplad till världsledande forskning och du får chansen att göra ditt examensarbete inom en bred, dynamisk och modern forskningsmiljö. Med kurser som täcker organiska molekyler och biologiska makromolekyler, samt deras syntes, samverkan och interaktioner, kommer du att vara väl förberedd för en framtid inom bioteknik och läkemedelsutveckling.;https://www.uu.se/utbildning/program/masterprogram-kemi-kemisk-biologi;Biokemi;;;;;;;;;;;;;;;;;;;;
54;Kvantteknologi;Master;2;120;Masterprogrammet i kvantteknologi vid Uppsala universitet förbereder dig för den framväxande kvantrevolutionen. Skaffa dig expertis inom optiska, elektroniska och magnetiska kvantfenomen och tillämpa dem på avancerad teknik. Dra nytta av praktiska projekt som leds av ledande experter inom kvantinnovation i en internationell miljö med toppmoderna anläggningar. Detta program rustar dig för framgång inom den akademiska världen och industrin.;;Kvantteknologi;Kvantfysik;;;;;;;;;;;;;;;;;;;
55;Masterprogram i bioinformatik – Biologibakgrund;Master;2;120;Vill du förstå funktionen hos människans arvsanlag, återskapa släktförhållanden mellan olika arter eller utveckla nya läkemedel? Masterprogrammet i bioinformatik erbjuder dig en utbildning i det tvärvetenskapliga området bioinformatik där teori och praktik från matematik, datavetenskap och biologi vävs samman. Du kommer att få kunskap som är central inom flera forskningsområden för att själv kunna bidra till bioinformatikens snabba utveckling;https://www.uu.se/utbildning/program/masterprogram-bioinformatik-biologibakgrund;Bioteknik;Dataanalys;;;;;;;;;;;;;;;;;;;
56;Masterprogram i bioinformatik – Datavetenskaplig bakgrund;Master;2;120;Har du en bakgrund inom datavetenskap och vill inrikta dig mot det spännande tvärvetenskapliga området bioinformatik? Vill du kombinera matematik, datavetenskap och biologi? Då är Masterprogrammet i bioinformatik något för dig. Under utbildningen får du kunskaper som är centrala inom olika forskningsområden, för att exempelvis förstå funktionen hos människans arvsanlag, återskapa släktförhållanden mellan arter eller utveckla nya av läkemedel.;https://www.uu.se/utbildning/program/masterprogram-bioinformatik-datavetenskaplig-bakgrund;Dataanalys;Bioteknik;;;;;;;;;;;;;;;;;;;
57;Masterprogram i biologi – Cell- och molekylärbiologi;Master;2;120;Att förstå de molekylära mekanismerna bakom cellers funktion, reproduktion och kommunikation är fundamentalt för att förstå flercelliga djur och växter. Kombinationen av cellbiologi och molekylär biologi i denna inriktning inom masterprogrammet i biologi uppmuntrar dig att utveckla en djup förståelse av biologiska system, alltifrån molekylära interaktioner på subatomär nivå till system och deras interaktioner i celler och organeller.;https://www.uu.se/utbildning/program/masterprogram-biologi-cell-och-molekylarbiologi;Biologi;Bioteknik;;;;;;;;;;;;;;;;;;;
58;Masterprogram i biologi – Ekologi och naturvård;Master;2;120;Om du vill arbeta med naturvård eller forska inom ämnena ekologi och bevarandebiologi ska du söka inriktningen ekologi och naturvård på masterprogrammet i biologi. Här möts flera ämnen inom biologin och behandlar aspekter på flera nivåer: individer, populationer, arter och samhälle. Att förstå vårt natur- och kulturarv och förvalta detta är en av de viktigaste uppgifterna för ekologer och bevarandebiologer.;https://www.uu.se/utbildning/program/masterprogram-biologi-ekologi-och-naturvard;Biologi;;;;;;;;;;;;;;;;;;;;
59;Masterprogram i biologi – Ekosystem och akvatisk ekologi;Master;2;120;Med inriktningen ekosystem och akvatisk ekologi inom masterprogrammet i biologi tar du ett helhetsgrepp på naturen. Du lär dig hur ekosystem fungerar med tyngdpunkt på sjöar och vattendrag. Genom kunskap om fysiska, kemiska och framför allt biologiska processer och deras interaktioner, lär du känna hur naturens ekosystem fungerar och hur människan påverkar dem. Utbildningen har starka kopplingar till yrkesverksamhet inom vatten- och naturvård, och ansluter till pågående forskning.;https://www.uu.se/utbildning/program/masterprogram-biologi-ekosystem-och-akvatisk-ekologi;Biologi;;;;;;;;;;;;;;;;;;;;
60;Masterprogram i biologi – Evolutionsbiologi;Master;2;120;Alla livsformer är sammanbundna bakåt i tiden och har en gemensam historia. Hur de har utvecklats och vilka processer som påverkat uppkomsten av livets mångfald är fokus för denna inriktning. Inriktningen evolutionsbiologi på masterprogrammet i biologi är valet för dig som vill forska inom evolutionsbiologi. Med evolutionsbiologi menas all form av biologi där evolution är viktigt för förståelsen av olika fenomen - allt ifrån evolutionär ekologi till genomevolution.;https://www.uu.se/utbildning/program/masterprogram-biologi-evolutionsbiologi;Biologi;;;;;;;;;;;;;;;;;;;;
61;Masterprogram i biologi – Immunologi och mikrobiologi;Master;2;120;Inriktningen immunologi och mikrobiologi inom masterprogrammet i biologi fokuserar på hur immunsystemet upptäcker och avlägsnar patogena bakterier, virus och parasiter. Förutom studier i infektionsbiologi, analyseras även vad som händer på cell- och molekylärnivå då immunsystemet överreagerar eller brister i tolerans mot kroppsegna vävnader. Detta kan exempelvis ske då allergier och autoimmunitet uppstår.;https://www.uu.se/utbildning/program/masterprogram-biologi-immunologi-och-mikrobiologi;Biologi;;;;;;;;;;;;;;;;;;;;
62;Masterprogram i biologi – Miljötoxikologi;Master;2;120;Är du intresserad av hur kemikalier påverkar människa och miljö och hur faror och risker med kemikalier bedöms? I så fall är inriktningen miljötoxikologi i masterprogrammet i biologi den rätta inriktningen för dig. Efter utbildningen kan du antingen jobba som miljötoxikolog - till exempel på något konsultföretag, någon statlig myndighet, eller inom miljöförvaltningar på kommuner - eller satsa på forskning inom toxikologi eller ekotoxikologi.;https://www.uu.se/utbildning/program/masterprogram-biologi-miljotoxikologi;Biologi;;;;;;;;;;;;;;;;;;;;
63;Masterprogram i biologi – NABiS – samnordisk inriktning mot biodiversitet och systematik;Master;2;120;All den variation och rikedom av organismer som finns på vår planet, och deras evolutionära förhållanden, är i fokus på denna samnordiska inriktning mot biodiversitet och systematik inom masterprogrammet i biologi. Kombinationen av molekylära metoder och fältstudier har resulterat inte bara i att nya arter ständigt upptäcks utan också att vi kan förstå deras fylogenetiska samband. Vill du kunna besvara frågor kring evolution, biogeografi och ursprunget till all variation är detta inriktningen för dig.;https://www.uu.se/utbildning/program/masterprogram-biologi-nabis-samnordisk-inriktning-mot-biodiversitet-och-systematik;Biologi;;;;;;;;;;;;;;;;;;;;
64;Masterprogram i dataanalys – Maskininlärning och statistik;Master;2;120;Är du intresserad av att fördjupa dig i stora mängder data? Vill du utveckla din kunskap för att hjälpa lösa några av dagens samhällsproblem? Med en master i dataanalys, med inriktning maskininlärning och statistik, får du lära dig att göra avancerade statistiska analyser och hitta ny kunskap i stora mängder data.;https://www.uu.se/utbildning/program/masterprogram-dataanalys-maskininlarning-och-statistik;Dataanalys;Statistik;;;;;;;;;;;;;;;;;;;
65;Masterprogram i geovetenskap – Geologi;Master;2;120;Vill du vara med i den gröna omställningen och se till så att samhället utvinner mineralresurser på ett ansvarsfullt sätt? Vill du se till att framtidens byggnader, tunnlar och lagring av kärnavfall blir både säkra och hållbara? Vill du arbeta för att reducera påverkan av vulkanutbrott och jordskred? På masterprogrammet i geovetenskap, inriktning geologi lär du dig att använda och bevara jordens resurser för att skapa en hållbar framtid.;https://www.uu.se/utbildning/program/masterprogram-geovetenskap-geologi;Geovetenskap;;;;;;;;;;;;;;;;;;;;
66;Masterprogram i geovetenskap – Hydrologi/hydrogeologi;Master;2;120;Är du fascinerad av vattnets resa från regn till floder och grundvatten, dess väg genom landskapet och dess samspel med miljön? Om du brinner för att hantera vattenresurser eller ta itu med vattenrelaterade katastrofer är masterprogrammet i geovetenskap något för dig! Inriktningen mot hydrologi/hydrogeologi ger dig möjlighet att studera hydrologiska processer som avrinning, grundvattenbildning, flöde och mycket mer.;https://www.uu.se/utbildning/program/masterprogram-geovetenskap-hydrologi-hydrogeologi;Geovetenskap;Vattenresurser;;;;;;;;;;;;;;;;;;;
67;Masterprogram i geovetenskap – Naturgeografi;Master;2;120;Vill du lära dig mer om de krafter och processer som formar jordens yta genom tiderna, och hur dessa är kopplade till förändringar i vårt klimat och vår miljö? Är du bekymrad över människans avtryck på landskapet som omger dig? Masterprogrammet i geovetenskap, med inriktning mot naturgeografi, ger dig kunskaper, metoder och färdigheter för att ta itu med dessa och andra frågor.;https://www.uu.se/utbildning/program/masterprogram-geovetenskap-naturgeografi;;;;;;;;;;;;;;;;;;;;;
68;Masterprogram i geovetenskap – Paleobiologi;Master;2;120;Är du intresserad av hur livet på jorden såg ut för miljontals år sedan? Vill du förstå hur livet har utvecklats och påverkats av jordens kemiska och fysiska förändringar? Är du nyfiken på hur klimatet och miljön har förändrats över tid? Masterprogrammet i geovetenskap, med inriktning paleobiologi, kombinerar forskning med biologiska vetenskaper för att återskapa och förstå de evolutionära förändringar som har ägt rum under historiens gång.;https://www.uu.se/utbildning/program/masterprogram-geovetenskap-paleobiologi;Geovetenskap;Paleobiologi;;;;;;;;;;;;;;;;;;;
69;Matematik;Master;2;120;Vill du stärka dina matematiska förmågor och fördjupa dig i matematikens eget universum? Med insikter i matematikens centrala och aktuella forskningsområden tar du en ledande roll som expert och problemlösare av abstrakta och teoretiska frågeställningar. De färdigheter och den kompetens du får är tillämpliga på en mängd olika områden och högt värderade oavsett vilken karriärväg du väljer.;https://www.uu.se/utbildning/program/masterprogram-matematik-matematik;Matematik;;;;;;;;;;;;;;;;;;;;
70;Matematisk fysik;Master;2;120;Är du angelägen om att förstå grundläggande fysik men fascineras samtidigt av matematikens elegans? Tycker du om att utföra explicita beräkningar men söker de underliggande kortfattade mönstren? Då är inriktningen matematisk fysik inom masterprogrammet i fysik något för dig. På programmet får du lära dig att kombinera fysikalisk intuition med matematisk abstraktion och noggrannhet, och bli en skapare av det språk som kommer att driva framtidens forskning.;https://www.uu.se/utbildning/program/masterprogram-fysik-matematisk-fysik;Fysik;Matematik;;;;;;;;;;;;;;;;;;;
71;Materialteknik;Master;2;120;Innovation inom material skapar möjligheter till utveckling inom all annan teknik. I takt med att medvetenheten om att tillgången på råmaterial är ändlig, växer också behovet av att ta fram nya hållbara material och tekniker. Masterprogrammet i materialteknik förbereder dig för att ta dig an dessa utmaningar. Programmet undervisas på Ångströmslaboratoriet, ett av Europas mest avancerade laboratorier för funktionella material och energi.;;Materialvetenskap;Materialteknik;;;;;;;;;;;;;;;;;;;
72;Materialvetenskap;Master;2;120;Materialvetenskap är grunden för innovationer och framgångar inom många områden. Utmaningar inom omställning till ett hållbart samhälle, energisektorn, samt tillgången till råmaterial ökar behoven på såväl utveckling av material som tekniker för materialframställning. Masterprogrammet i materialvetenskap förbereder dig att möta dessa framtidsutmaningar.;;Materialvetenskap;;;;;;;;;;;;;;;;;;;;
73;Metrologi och klimatfysik;Master;2;120;Är du intresserad av väder, prognoser, klimat och klimatförändringar? Då är inriktningen meteorologi och klimatfysik inom masterprogrammet i fysik rätt val för dig. Du får både en djup och bred kunskap inom dessa områden och blir beredd på ett jobb som till exempel prognosmeteorolog eller rådgivare för företag med väderberoende verksamhet. Du blir också väl förberedd på att ta dig an doktorandstudier eller inleda en internationell karriär.;https://www.uu.se/utbildning/program/masterprogram-fysik-meteorologi-klimatfysik;Fysik;Metrologi;;;;;;;;;;;;;;;;;;;
74;Organisk kemi;Master;2;120;Frågar du dig själv hur du kan bli rustad för framtida forskning och utveckling inom antingen den akademiska världen eller industrin? Svaret finns här. På vårt masterprogram i kemi med inriktning mot organisk kemi är du nära kopplad till världsledande forskargrupper inom området. Med lärare som är framstående experter får du en unik chans att göra ditt examensarbete vid forskningsfronten.;https://www.uu.se/utbildning/program/masterprogram-kemi-organisk-kemi;Organiskkemi;Kemi;;;;;;;;;;;;;;;;;;;
75;Paleobiologi - PANGEA;Master;2;120;Är du intresserad av hur livet på jorden såg ut för miljarder år sedan? Vill du förstå hur livet har påverkats av jordens kemiska och fysikaliska förändringar? Och hur har klimatet och miljön förändrats över tid? Masterprogram i paleobiologi – PANGEA är ett Erasmus Mundus-program som är ett samarbete mellan universiteten i Uppsala, Lille i Frankrike, Aten i Grekland och Minho i Portugal.;;Bioteknik;;;;;;;;;;;;;;;;;;;;
76;Teoretisk fysik - kvantfält - strängteori;Master;2;120;Studera universums grundläggande lagar med vårt masterprogram med inriktning mot teoretisk fysik – kvantfält- och strängteori. Du kommer att få den omfattande utbildning som förväntas av en teoretisk fysiker, skaffa nödvändiga matematiska färdigheter och utforska genombrott inom gauge- och konformteori, strängteori, holografi och mycket mer. Under ledning av framstående forskare ger du dig ut på en upptäcktsresa i framkant när det gäller att förstå naturen.;https://www.uu.se/utbildning/program/masterprogram-fysik-teoretisk-fysik;Fysik;;;;;;;;;;;;;;;;;;;;
77;Teoretisk kemo och beräkningskemi;Master;2;120;Vill du utveckla morgondagens molekyler och material med hjälp av beräkningskemi och teoretisk kemi kombinerat med nya maskininlärningsmetoder? På masterprogrammet i kemi - teoretisk kemi och beräkningskemi kommer du att ha en unik möjlighet att dyka djupt in i de mest spännande områdena av elektroniska strukturberäkningar, simuleringar av molekylär dynamik och accelererade modelleringsmetoder för maskininlärning. Låt din passion för beräkningskemi ta dig till nya höjder!;;Beräkningskemi;Beräkningsvetenskap;;;;;;;;;;;;;;;;;;;
78;Tillämpad beräkningsvetenskap;Master;2;120;Hur kan datorsimuleringar av komplexa problem och hantering av stora datamängder förbättra och forma framtida vetenskapliga undersökningar och ingenjörsarbete? Masterprogrammet i tillämpad beräkningsvetenskap syftar till att bredda och fördjupa dina kunskaper inom naturvetenskap eller teknik genom att lära dig tillämpa beräkningsmetoder, programmering, programvara samt matematiska och statistiska modeller inom ditt specifika intresseområde.;;Geovetenskap;Paleobiologi;;;;;;;;;;;;;;;;;;;
79;Tillämpad bioteknik;Master;2;120;Masterprogrammet i tillämpad bioteknik vänder sig till dig som vill inrikta dig mot tillämpad bioteknik och samtidigt få kunskap om projektstyrning och entreprenörskap. Det är ett program som ger dig en unik profil och där du möter både svenska och internationella studenter och lärare, vilket ger dig möjlighet att skapa ett nätverk inför framtiden. Programmet ger dig en unik profil som förbereder dig för en karriär i bioteknik inom både akademin och industrin.;;Bioteknik;;;;;;;;;;;;;;;;;;;;
80;Tillämpad matematik och statistik;Master;2;120;De flesta saker i den verkliga världen är komplexa, från biologiska system till finansmarknader och industriella processer. Att förklara dem är avgörande för att göra framsteg eller fatta beslut och för det krävs lösningar på många matematiska problem. Detta masterprogram med inriktning tillämpad matematik och statistik ger dig verktygen för att komma fram till svar och lösningar. Efter examen är du extremt flexibel och kan arbeta inom många olika branscher.;https://www.uu.se/utbildning/program/masterprogram-matematik-tillampad-matematik-och-statistik;Matematik;Statistik;;;;;;;;;;;;;;;;;;;
81;Vattenteknik;Master;2;120;Tillgång till rent vatten är en grundläggande förutsättning för vårt moderna samhälle, och vatteningenjören spelar en central roll i distribuering, lagring och rening av vatten. Som student på masterprogrammet i vattenteknik kommer du att lära dig att använda banbrytande mät-, simulerings- och dataanalysmetoder för en hållbar utveckling av vattenresurser i bebyggda och naturliga miljöer. Programmet har en profil mot digitalisering i vattensektorn.;;Vattenresurser;Programmering;;;;;;;;;;;;;;;;;;;
82;Vindkraftsprojektering (120 hp);Master;2;120;Idag sker en kraftig utbyggnad av vindkraften för att klara klimatmålen och energiförsörjningen samt möta efterfrågan på förnybar el. Det finns därför ett stort behov av yrkeskunniga som kan leda vindkraftsprojekt, både nationellt och internationellt. Det här ettåriga magisterprogrammet i vindkraftsprojektering är tvärvetenskapligt och öppet för naturvetare, samhällsvetare och teknologer. Programmet lägger grunden för en karriär inom den globala vindkraftsindustrin.;https://www.uu.se/utbildning/program/masterprogram-vindkraftsprojektering;Byggteknik;;;;;;;;;;;;;;;;;;;;
;;;;;;;;;;;;;;;;;;;;;;;;;;;
;;;;;;;;;;;;;;;;;;;;;;;;;;;
;;;;;;;;;;;;;;;;;;;;;;;;;;;
;;;;;;;;;;;;;;;;;;;;;;;;;;;
;;;;;;;;;;;;;;;;;;;;;;;;;;;
;;;;;;;;;;;;;;;;;;;;;;;;;;;
;;;;;;;;;;;;;;;;;;;;;;;;;;;
;;;;;;;;;;;;;;;;;;;;;;;;;;;
;;;;;;;;;;;;;;;;;;;;;;;;;;;
;;;;;;;;;;;;;;;;;;;;;;;;;;;
;;;;;;;;;;;;;;;;;;;;;;;;;;;
;;;;;;;;;;;;;;;;;;;;;;;;;;;
;;;;;;;;;;;;;;;;;;;;;;;;;;;
;;;;;;;;;;;;;;;;;;;;;;;;;;;
;;;;;;;;;;;;;;;;;;;;;;;;;;;
;;;;;;;;;;;;;;;;;;;;;;;;;;;
;;;;;;;;;;;;;;;;;;;;;;;;;;;
;;;;;;;;;;;;;;;;;;;;;;;;;;;
;;;;;;;;;;;;;;;;;;;;;;;;;;;
;;;;;;;;;;;;;;;;;;;;;;;;;;;
;;;;;;;;;;;;;;;;;;;;;;;;;;;
;;;;;;;;;;;;;;;;;;;;;;;;;;;
;;;;;;;;;;;;;;;;;;;;;;;;;;;
;;;;;;;;;;;;;;;;;;;;;;;;;;;
;;;;;;;;;;;;;;;;;;;;;;;;;;;
;;;;;;;;;;;;;;;;;;;;;;;;;;;
;;;;;;;;;;;;;;;;;;;;;;;;;;;
;;;;;;;;;;;;;;;;;;;;;;;;;;;
;;;;;;;;;;;;;;;;;;;;;;;;;;;
;;;;;;;;;;;;;;;;;;;;;;;;;;;
;;;;;;;;;;;;;;;;;;;;;;;;;;;
;;;;;;;;;;;;;;;;;;;;;;;;;;;
;;;;;;;;;;;;;;;;;;;;;;;;;;;
;;;;;;;;;;;;;;;;;;;;;;;;;;;
;;;;;;;;;;;;;;;;;;;;;;;;;;;
;;;;;;;;;;;;;;;;;;;;;;;;;;;
;;;;;;;;;;;;;;;;;;;;;;;;;;;
;;;;;;;;;;;;;;;;;;;;;;;;;;;
;;;;;;;;;;;;;;;;;;;;;;;;;;;
;;;;;;;;;;;;;;;;;;;;;;;;;;;
;;;;;;;;;;;;;;;;;;;;;;;;;;;
;;;;;;;;;;;;;;;;;;;;;;;;;;;
;;;;;;;;;;;;;;;;;;;;;;;;;;;
;;;;;;;;;;;;;;;;;;;;;;;;;;;
;;;;;;;;;;;;;;;;;;;;;;;;;;;
;;;;;;;;;;;;;;;;;;;;;;;;;;;
;;;;;;;;;;;;;;;;;;;;;;;;;;;
;;;;;;;;;;;;;;;;;;;;;;;;;;;
;;;;;;;;;;;;;;;;;;;;;;;;;;;
;;;;;;;;;;;;;;;;;;;;;;;;;;;
;;;;;;;;;;;;;;;;;;;;;;;;;;;
;;;;;;;;;;;;;;;;;;;;;;;;;;;
;;;;;;;;;;;;;;;;;;;;;;;;;;;
;;;;;;;;;;;;;;;;;;;;;;;;;;;
;;;;;;;;;;;;;;;;;;;;;;;;;;;
;;;;;;;;;;;;;;;;;;;;;;;;;;;
;;;;;;;;;;;;;;;;;;;;;;;;;;;
;;;;;;;;;;;;;;;;;;;;;;;;;;;
;;;;;;;;;;;;;;;;;;;;;;;;;;;
;;;;;;;;;;;;;;;;;;;;;;;;;;;
;;;;;;;;;;;;;;;;;;;;;;;;;;;
;;;;;;;;;;;;;;;;;;;;;;;;;;;
;;;;;;;;;;;;;;;;;;;;;;;;;;;
;;;;;;;;;;;;;;;;;;;;;;;;;;;
;;;;;;;;;;;;;;;;;;;;;;;;;;;
;;;;;;;;;;;;;;;;;;;;;;;;;;;
;;;;;;;;;;;;;;;;;;;;;;;;;;;
;;;;;;;;;;;;;;;;;;;;;;;;;;;
;;;;;;;;;;;;;;;;;;;;;;;;;;;
;;;;;;;;;;;;;;;;;;;;;;;;;;;
;;;;;;;;;;;;;;;;;;;;;;;;;;;
;;;;;;;;;;;;;;;;;;;;;;;;;;;
;;;;;;;;;;;;;;;;;;;;;;;;;;;
;;;;;;;;;;;;;;;;;;;;;;;;;;;
;;;;;;;;;;;;;;;;;;;;;;;;;;;
;;;;;;;;;;;;;;;;;;;;;;;;;;;
;;;;;;;;;;;;;;;;;;;;;;;;;;;
;;;;;;;;;;;;;;;;;;;;;;;;;;;
;;;;;;;;;;;;;;;;;;;;;;;;;;;
